{
  "$schema": "https://json-schema.org/draft/2020-12/schema",
  "$id": "https://agent-eroom.local/schemas/sortie-lot-eof.json",
  "title": "Contrat de sortie d'un lot d'audit EOF",
  "description": "Format strict pour les fichiers de sortie de lots multi-agents. Tout lot (agent, script, humain) produisant des verdicts EOF doit respecter ce contrat. Le script de fusion refuse tout fichier non conforme au lieu de le fusionner.",
  "type": "object",
  "required": ["lot_id", "genere_le", "entrees", "criteres"],
  "additionalProperties": false,
  "properties": {
    "lot_id": {
      "type": "string",
      "description": "Identifiant unique du lot (ex: 'lot-mesures-har', 'lot-qcm-client', 'lot-osint-accessibilite'). Utilisé pour tracer l'origine de chaque verdict dans le rapport final.",
      "minLength": 1
    },
    "genere_le": {
      "type": "string",
      "format": "date-time",
      "description": "Horodatage ISO 8601 de génération du fichier (ex: '2026-09-04T12:34:56+00:00'). Permet de détecter les sorties périmées."
    },
    "entrees": {
      "type": "array",
      "description": "Liste des chemins de fichiers ou URLs publiques réellement lus par le lot. Peut être vide pour un lot déclaratif (QCM rempli à la main). Traçabilité : permet de relier un verdict à ses sources de données.",
      "items": {
        "type": "string"
      }
    },
    "mesure": {
      "type": "object",
      "description": "Optionnel. Convention d'état de mesure (cf. documentation/implementation/convention-etat-de-mesure.md) : rend compte d'un échec de la SOURCE du lot elle-même (ex. fichier de questionnaire absent ou illisible), distinct d'un échec sur un critère individuel.",
      "required": ["statut", "cible", "detail"],
      "additionalProperties": false,
      "properties": {
        "statut": {
          "type": "string",
          "enum": ["ok", "rien_trouve", "echec_reseau", "echec_lecture", "echec_analyse"]
        },
        "cible": {
          "type": "string",
          "description": "Ce qui était cherché : chemin de fichier, URL, nom de champ."
        },
        "detail": {
          "type": ["string", "null"],
          "description": "Phrase courte, ou null si statut vaut 'ok' et qu'il n'y a rien à préciser."
        }
      }
    },
    "criteres": {
      "type": "array",
      "description": "Liste des critères jugés par ce lot. Un critère peut être partiellement renseigné (contexte seulement) ou entièrement tranché (reponse + coefficient). Le script de fusion consolide ces entrées multiples en un seul verdict par critère.",
      "items": {
        "type": "object",
        "required": ["id", "categorie"],
        "additionalProperties": false,
        "properties": {
          "id": {
            "type": "string",
            "description": "Identifiant du critère au référentiel EOF (ex: '1.5', '3.3') ou au diagnostic rapide (ex: '0.1', '0.16'). Doit exister dans le référentiel, sinon rejet.",
            "pattern": "^[0-9]+\\.[0-9]+$"
          },
          "reponse": {
            "type": ["string", "null"],
            "description": "Libellé exact de l'option cochée, issu du vocabulaire du référentiel POUR CE CRITÈRE (options_evaluation ou crans selon le type). Si null, le critère reste non tranché (indice contextuel seul)."
          },
          "coefficient": {
            "type": ["number", "null"],
            "description": "Coefficient numérique associé à la réponse, selon le mapping options_evaluation_coefficient du référentiel. Doit être null si et seulement si reponse est null. Si reponse est non null, doit valoir EXACTEMENT le coefficient défini par le référentiel pour ce libellé."
          },
          "provenance": {
            "type": ["string", "null"],
            "description": "Provenance du verdict ou de l'indice : 'collecte' (mesuré par nos scripts : HAR, en-têtes HTTP, API), 'estime' (déduit par un LLM à partir d'indices réels), 'declare' (déclaré publiquement par l'organisation auditée : page d'accessibilité, mentions légales), 'precise' (coché par le client dans le questionnaire, sans preuve), 'suppose' (déduit depuis un indice faible, signal ambigu). Requis si reponse ou contexte sont non null. Détermine la précédence de fusion : collecte > estime > declare > precise > suppose.",
            "enum": ["collecte", "estime", "declare", "precise", "suppose", null]
          },
          "source": {
            "type": ["string", "null"],
            "description": "Origine du verdict ou de l'indice : chemin de fichier (ex: 'audit/har-analysis.json'), URL publique (ex: 'https://example.com/accessibilite'), ou référence de ligne de QCM (ex: 'QCM question 3'). Requis si reponse ou contexte sont non null. Chaine non vide.",
            "minLength": 1
          },
          "contexte": {
            "type": ["string", "null"],
            "description": "Phrase française d'indice contextuel, quand le critère n'est pas tranché mais qu'un signal existe. Affiché en annexe du rapport pour aider le jugement humain. Ne remplace jamais un verdict : si le signal est ambigu, laisser reponse à null."
          },
          "categorie": {
            "type": "string",
            "description": "Type de donnée utilisée pour juger ce critère : 'automatisable' (verdict tranché par mesure ou règle déterministe), 'partiel' (indice faible, contexte seul), 'aucune_donnee' (aucune donnée disponible pour ce critère dans ce lot). Vocabulaire imposé, hérité de la table de correspondance EOF.",
            "enum": ["automatisable", "partiel", "aucune_donnee"]
          },
          "sans_objet": {
            "type": ["boolean", "null"],
            "description": "Indique si le critère est sans objet pour ce service audité : true retire le critère du numérateur ET du dénominateur du calcul de potentiel d'optimisation. Distinct de la réponse '🚫 Non applicable' qui laisse le potentiel_max au dénominateur."
          }
        },
        "allOf": [
          {
            "if": {
              "properties": {
                "reponse": { "type": "string" }
              },
              "required": ["reponse"]
            },
            "then": {
              "required": ["provenance", "source"],
              "properties": {
                "coefficient": { "type": "number" }
              }
            }
          },
          {
            "if": {
              "properties": {
                "contexte": { "type": "string" }
              },
              "required": ["contexte"]
            },
            "then": {
              "required": ["provenance", "source"]
            }
          },
          {
            "if": {
              "properties": {
                "reponse": { "type": "null" }
              }
            },
            "then": {
              "properties": {
                "coefficient": { "type": "null" }
              }
            }
          }
        ]
      }
    }
  }
}
