{
  "lot_id": "jugement-automatique",
  "genere_le": "2026-09-15T16:53:53.337001+00:00",
  "entrees": [
    "env-data.json",
    "audit/har-analysis.json",
    "audit/coverage-analysis.json",
    "cwv.json",
    "security-headers-analysis.json",
    "wellknown-scan.json",
    "html-css-criteria.json",
    "pages-publiques-criteria.json"
  ],
  "criteres": [
    {
      "id": "1.4",
      "categorie": "partiel",
      "provenance": "suppose",
      "source": "html-css-criteria.json: pages[].native_buttons vs pages[].custom_role_buttons",
      "contexte": "Boutons HTML natifs détectés : 14 ; boutons avec attribut role='button' : 1 (sur l'ensemble des pages)"
    },
    {
      "id": "1.5",
      "categorie": "automatisable",
      "reponse": "✅ Point fort confirmé",
      "coefficient": 0,
      "provenance": "collecte",
      "source": "html-css-criteria.json: aucune balise <video|audio autoplay> détectée sur les pages auditées"
    },
    {
      "id": "1.6",
      "categorie": "automatisable",
      "reponse": "🤔 À évaluer",
      "coefficient": 0,
      "provenance": "estime",
      "source": "html-css-criteria.json: adaptive_img_ratio par page = [0.66, 0.27, 0.0, 0.27, 0.27, 0.71] ; media_query_count = 228 (signaux discordants entre pages/CSS, contrainte déterministe : ne pas trancher)"
    },
    {
      "id": "1.9",
      "categorie": "partiel",
      "provenance": "suppose",
      "source": "env-data.json: har_summary.efootprint.data_transferred_bytes_real (poids réel transféré)",
      "contexte": "Données réellement transférées (page la plus lourde) : 702 Ko"
    },
    {
      "id": "1.11",
      "categorie": "partiel",
      "provenance": "suppose",
      "source": "html-css-criteria.json: css.has_prefers_reduced_or_scheme",
      "contexte": "Aucune règle @media (prefers-reduced-motion ou prefers-color-scheme) détectée dans les feuilles de style"
    },
    {
      "id": "1.12",
      "categorie": "automatisable",
      "reponse": "🤔 À évaluer",
      "coefficient": 0,
      "provenance": "estime",
      "source": "security-headers-analysis.json + har-analysis.json: pistage déclaré au CSP mais absent du HAR (hs-analytics.net, hs-banner.com, hs-scripts.com, hsadspixel.net, hsforms.com, hsforms.net, hubapi.com, hubspot.com, licdn.com, linkedin.com, octo-6695516.hs-sites.com, static.hsappstatic.net) — probable capture sans accepter le consentement"
    },
    {
      "id": "1.13",
      "categorie": "automatisable",
      "reponse": "✅ Point fort confirmé",
      "coefficient": 0,
      "provenance": "collecte",
      "source": "cwv.json: accessibility_score_pct (PageSpeed Insights) — pire page/stratégie = 100, valeurs = [100, 100, 100, 100, 100, 100, 100, 100, 100, 100, 100]"
    },
    {
      "id": "1.14",
      "categorie": "partiel",
      "provenance": "suppose",
      "source": "env-data.json: pages[].size_kb (comparaison entre pages du même parcours)",
      "contexte": "Page la plus lourde : https://octo.com/publications (1003 Ko)"
    },
    {
      "id": "1.15",
      "categorie": "partiel",
      "provenance": "estime",
      "source": "env-data.json: traffic.visits_per_year / traffic.monthly_visits (estimation SimilarWeb)",
      "contexte": "Trafic estimé : 293 000 visites/an (SimilarWeb (estimation))"
    },
    {
      "id": "1.16",
      "categorie": "partiel",
      "provenance": "estime",
      "source": "env-data.json: traffic.visits_per_year",
      "contexte": "Trafic estimé : 293 000 visites/an (SimilarWeb (estimation))"
    },
    {
      "id": "2.1",
      "categorie": "automatisable",
      "reponse": "✅ Point fort confirmé",
      "coefficient": 0,
      "provenance": "estime",
      "source": "env-data.json: ai_external_apis vide, aucune techno IA/blockchain détectée"
    },
    {
      "id": "2.3",
      "categorie": "partiel",
      "provenance": "suppose",
      "source": "security-headers-analysis.json: Content-Security-Policy (famille paas_backend)",
      "contexte": "Plusieurs composants d'hébergement distincts détectés (herokuapp.com), ce qui suggère une architecture séparant les responsabilités. Nous ne pouvons pas évaluer de l'extérieur l'efficacité de leur couplage ni l'optimisation de leur communication."
    },
    {
      "id": "2.5",
      "categorie": "partiel",
      "provenance": "suppose",
      "source": "har-analysis.json: duplicate_urls (liste {url, count}) ; http_codes (part de 304)",
      "contexte": "https://api.analytics.octo.tools/log/hb chargé 54 fois ; https://api.analytics.octo.tools/log/ chargé 18 fois ; https://octo.com/style.css?v=2026-6-10-1-1 chargé 11 fois"
    },
    {
      "id": "3.2",
      "categorie": "partiel",
      "provenance": "declare",
      "source": "pages-publiques-criteria.json: declarations_suivi (phrase extraite de pages HTML publiques d'éco-conception)",
      "contexte": "Déclaration sur eco-conception.html : \"Nous avons fixé plusieurs objectifs à notre démarche, notamment : Réduire l'empreinte environnementale de notre site internet en diminuant la consommation d'énergie nécessaire à son fonctionnement.\""
    },
    {
      "id": "3.3",
      "categorie": "automatisable",
      "reponse": "💡 Potentiel d'amélioration identifié",
      "coefficient": 1,
      "provenance": "collecte",
      "source": "env-data.json: servers[] = octo.com (DE, 381 gCO2/kWh) (seuil 250 gCO2/kWh dépassé)"
    },
    {
      "id": "3.5",
      "categorie": "partiel",
      "provenance": "suppose",
      "source": "security-headers-analysis.json: Content-Security-Policy (familles paas_backend, cdn_bibliotheques, infra_cloud_generique)",
      "contexte": "Votre service fait appel à 6 service(s) d'infrastructure externe(s) (hébergement, diffusion de contenu, cloud) : herokuapp.com, cdn.jsdelivr.net, cdnjs.cloudflare.com, amazonaws.com, googleapis.com..."
    },
    {
      "id": "3.7",
      "categorie": "partiel",
      "provenance": "suppose",
      "source": "security-headers-analysis.json: Content-Security-Policy (famille paas_backend)",
      "contexte": "Votre service s'appuie sur une plate-forme d'hébergement (herokuapp.com) capable d'ajuster automatiquement ses ressources. Nous ne pouvons pas voir de l'extérieur si cet ajustement est activé chez vous, ni si votre charge varie assez pour le justifier."
    },
    {
      "id": "5.4",
      "categorie": "automatisable",
      "reponse": "✅ Point fort confirmé",
      "coefficient": 0,
      "provenance": "collecte",
      "source": "cwv.json: toutes les pages sous les seuils CWV 'good'"
    },
    {
      "id": "5.5",
      "categorie": "partiel",
      "provenance": "suppose",
      "source": "coverage-analysis.json (JS/CSS inutilisé par page) ; cwv.json (par page)",
      "contexte": "https://octo.com/ : JavaScript inutilisé 79.02% ; https://octo.com/recrutement : JavaScript inutilisé 71.68%"
    },
    {
      "id": "6.1",
      "categorie": "partiel",
      "provenance": "suppose",
      "source": "security-headers-analysis.json: worst_page.grade (score sécurité local, proxy de maturité prod)",
      "contexte": "Score en-têtes de sécurité HTTP : 70% (grade B) sur https://octo.com/recrutement/offers/consultant-mlops-engineer-confirmesenior-fhn - indicateur parmi d'autres de la maturité en production"
    },
    {
      "id": "6.3",
      "categorie": "partiel",
      "provenance": "suppose",
      "source": "*.har: en-têtes Last-Modified des ressources 1st-party (code HTML/CSS/JS)",
      "contexte": "ressource de votre site la plus récente : 0.5 jour(s) avant la capture (publiée à 01:01 UTC) ; les 24 ressources de code (HTML/CSS/JS) sont publiées en 13 s (mise en ligne en un seul bloc) ; les adresses de vos fichiers portent une date (v=2026-6-10-1-1) qui concorde à 19 s près avec la date de dernière modification déclarée par votre serveur, donc produite par votre chaîne de fabrication"
    },
    {
      "id": "6.6",
      "categorie": "partiel",
      "provenance": "suppose",
      "source": "cwv.json: best_practices_score_pct ; security-headers-analysis.json: worst_page.grade ; wellknown-scan.json: security_txt.present",
      "contexte": "Audit Lighthouse - Bonnes Pratiques (pire page) : 73% ; en-têtes de sécurité (pire page) : grade B ; fichier security.txt : absent"
    },
    {
      "id": "6.8",
      "categorie": "partiel",
      "provenance": "suppose",
      "source": "cwv.json: lighthouse_insights['duplicated-javascript'] (audit Lighthouse)",
      "contexte": "Aucune duplication de code JavaScript détectée par l'audit Lighthouse (score parfait). Cela ne prouve pas que votre gestion des dépendances soit optimale, seulement qu'aucune duplication évidente n'a été repérée."
    },
    {
      "id": "0.16",
      "categorie": "automatisable",
      "reponse": "2- < 500 gCO2e / kWh",
      "provenance": "collecte",
      "source": "env-data.json: servers[].carbon_intensity_g_kwh = 381 gCO2e/kWh (doublon de 3.3, même donnée)"
    }
  ]
}